	act	scene	char_from	char_to	sentence
744	4	5	KING	OPHELIA	Follow her close; give her good watch, I pray you. O, this is the poison of deep grief; it springs All from her father’s death. O Gertrude, Gertrude, When sorrows come, they come not single spies, But in battalions. First, her father slain; Next, your son gone; and he most violent author Of his own just remove; the people muddied, Thick and and unwholesome in their thoughts and whispers For good Polonius’ death; and we have done but greenly In hugger-mugger to inter him. Poor Ophelia Divided from herself and her fair judgment, Without the which we are pictures or mere beasts. Last, and as much containing as all these, Her brother is in secret come from France, Feeds on his wonder, keeps himself in clouds, And wants not buzzers to infect his ear With pestilent speeches of his father’s death, Wherein necessity, of matter beggar’d, Will nothing stick our person to arraign In ear and ear. O my dear Gertrude, this, Like to a murdering piece, in many places Gives me superfluous death.
745	4	5	QUEEN	KING	Alack, what noise is this?
746	4	5	KING	QUEEN	Where are my Switzers? Let them guard the door. Enter a Gentleman. What is the matter?
747	4	5	GENTLEMAN	KING	Save yourself, my lord. The ocean, overpeering of his list, Eats not the flats with more impetuous haste Than young Laertes, in a riotous head, O’erbears your offices. The rabble call him lord, And, as the world were now but to begin, Antiquity forgot, custom not known, The ratifiers and props of every word, They cry ‘Choose we! Laertes shall be king!’ Caps, hands, and tongues applaud it to the clouds, ‘Laertes shall be king, Laertes king.’
748	4	5	QUEEN	GENTLEMAN	How cheerfully on the false trail they cry. O, this is counter, you false Danish dogs.
749	4	5	KING	QUEEN	The doors are broke. Enter Laertes, armed; Danes following.
750	4	5	LAERTES	KING	Where is this king?—Sirs, stand you all without. Danes. No, let’s come in.
751	4	5	LAERTES	KING	I pray you, give me leave.
752	4	5	DANES	LAERTES	We will, we will.
753	4	5	LAERTES	DANES	I thank you. Keep the door. O thou vile king, Give me my father.
754	4	5	QUEEN	LAERTES	Calmly, good Laertes.
755	4	5	LAERTES	QUEEN	That drop of blood that’s calm proclaims me bastard; Cries cuckold to my father, brands the harlot Even here between the chaste unsmirched brow Of my true mother.
756	4	5	KING	LAERTES	What is the cause, Laertes, That thy rebellion looks so giant-like?— Let him go, Gertrude. Do not fear our person. There’s such divinity doth hedge a king, That treason can but peep to what it would, Acts little of his will.—Tell me, Laertes, Why thou art thus incens’d.—Let him go, Gertrude:— Speak, man.
757	4	5	LAERTES	KING	Where is my father?
758	4	5	KING	LAERTES	Dead.
759	4	5	QUEEN	KING	But not by him.
760	4	5	KING	QUEEN	Let him demand his fill.
761	4	5	LAERTES	KING	How came he dead? I’ll not be juggled with. To hell, allegiance! Vows, to the blackest devil! Conscience and grace, to the profoundest pit! I dare damnation. To this point I stand, That both the worlds, I give to negligence, Let come what comes; only I’ll be reveng’d Most throughly for my father.
762	4	5	KING	LAERTES	Who shall stay you?
763	4	5	LAERTES	KING	My will, not all the world. And for my means, I’ll husband them so well, They shall go far with little.
764	4	5	KING	LAERTES	Good Laertes, If you desire to know the certainty Of your dear father’s death, is’t writ in your revenge That, sweepstake, you will draw both friend and foe, Winner and loser?
765	4	5	LAERTES	KING	None but his enemies.
766	4	5	KING	LAERTES	Will you know them then?
767	4	5	LAERTES	KING	To his good friends thus wide I’ll ope my arms; And, like the kind life-rendering pelican, Repast them with my blood.
768	4	5	KING	LAERTES	Why, now you speak Like a good child and a true gentleman. That I am guiltless of your father’s death, And am most sensibly in grief for it, It shall as level to your judgment ’pear As day does to your eye.
769	4	5	DANES	KING	Let her come in.
770	4	5	LAERTES	DANES	How now! What noise is that? Re-enter Ophelia, fantastically dressed with straws and flowers. O heat, dry up my brains. Tears seven times salt, Burn out the sense and virtue of mine eye. By heaven, thy madness shall be paid by weight, Till our scale turn the beam. O rose of May! Dear maid, kind sister, sweet Ophelia! O heavens, is’t possible a young maid’s wits Should be as mortal as an old man’s life? Nature is fine in love, and where ’tis fine, It sends some precious instance of itself After the thing it loves.
771	4	5	OPHELIA	LAERTES	They bore him barefac’d on the bier, Hey no nonny, nonny, hey nonny And on his grave rain’d many a tear.— Fare you well, my dove!
772	4	5	LAERTES	OPHELIA	Hadst thou thy wits, and didst persuade revenge, It could not move thus.
773	4	5	OPHELIA	LAERTES	You must sing ‘Down a-down, and you call him a-down-a.’ O, how the wheel becomes it! It is the false steward that stole his master’s daughter.
774	4	5	LAERTES	OPHELIA	This nothing’s more than matter.
775	4	5	OPHELIA	LAERTES	There’s rosemary, that’s for remembrance; pray love, remember. And there is pansies, that’s for thoughts.
776	4	5	LAERTES	OPHELIA	A document in madness, thoughts and remembrance fitted.
777	4	5	OPHELIA	LAERTES	There’s fennel for you, and columbines. There’s rue for you; and here’s some for me. We may call it herb of grace o’ Sundays. O you must wear your rue with a difference. There’s a daisy. I would give you some violets, but they wither’d all when my father died. They say he made a good end. For bonny sweet Robin is all my joy.
778	4	5	LAERTES	OPHELIA	Thought and affliction, passion, hell itself She turns to favour and to prettiness.
779	4	5	OPHELIA	LAERTES	And will he not come again? And will he not come again? No, no, he is dead, Go to thy death-bed, He never will come again. His beard was as white as snow, All flaxen was his poll. He is gone, he is gone, And we cast away moan. God ha’ mercy on his soul. And of all Christian souls, I pray God. God b’ wi’ ye.
780	4	5	LAERTES	OPHELIA	Do you see this, O God?
781	4	5	KING	LAERTES	Laertes, I must commune with your grief, Or you deny me right. Go but apart, Make choice of whom your wisest friends you will, And they shall hear and judge ’twixt you and me. If by direct or by collateral hand They find us touch’d, we will our kingdom give, Our crown, our life, and all that we call ours To you in satisfaction; but if not, Be you content to lend your patience to us, And we shall jointly labour with your soul To give it due content.
782	4	5	LAERTES	KING	Let this be so; His means of death, his obscure burial,— No trophy, sword, nor hatchment o’er his bones, No noble rite, nor formal ostentation,— Cry to be heard, as ’twere from heaven to earth, That I must call’t in question.
783	4	5	KING	LAERTES	So you shall. And where th’offence is let the great axe fall. I pray you go with me.
784	4	6	HORATIO	SERVANT	What are they that would speak with me?
785	4	6	SERVANT	HORATIO	Sailors, sir. They say they have letters for you.
786	4	6	HORATIO	SERVANT	Let them come in. I do not know from what part of the world I should be greeted, if not from Lord Hamlet. Enter Sailors.
787	4	6	FIRST SAILOR	HORATIO	God bless you, sir.
788	4	6	HORATIO	FIRST SAILOR	Let him bless thee too.
789	4	6	FIRST SAILOR	HORATIO	He shall, sir, and’t please him. There’s a letter for you, sir. It comes from th’ambassador that was bound for England; if your name be Horatio, as I am let to know it is.
790	4	6	HORATIO	FIRST SAILOR	‘Horatio, when thou shalt have overlooked this, give these fellows some means to the King. They have letters for him. Ere we were two days old at sea, a pirate of very warlike appointment gave us chase. Finding ourselves too slow of sail, we put on a compelled valour, and in the grapple I boarded them. On the instant they got clear of our ship, so I alone became their prisoner. They have dealt with me like thieves of mercy. But they knew what they did; I am to do a good turn for them. Let the King have the letters I have sent, and repair thou to me with as much haste as thou wouldst fly death. I have words to speak in thine ear will make thee dumb; yet are they much too light for the bore of the matter. These good fellows will bring thee where I am. Rosencrantz and Guildenstern hold their course for England: of them I have much to tell thee. Farewell. He that thou knowest thine,
791	4	6	HAMLET	HORATIO	’ Come, I will give you way for these your letters, And do’t the speedier, that you may direct me To him from whom you brought them.
792	4	7	KING	LAERTES	Now must your conscience my acquittance seal, And you must put me in your heart for friend, Sith you have heard, and with a knowing ear, That he which hath your noble father slain Pursu’d my life.
793	4	7	LAERTES	KING	It well appears. But tell me Why you proceeded not against these feats, So crimeful and so capital in nature, As by your safety, wisdom, all things else, You mainly were stirr’d up.
794	4	7	KING	LAERTES	O, for two special reasons, Which may to you, perhaps, seem much unsinew’d, But yet to me they are strong. The Queen his mother Lives almost by his looks; and for myself,— My virtue or my plague, be it either which,— She’s so conjunctive to my life and soul, That, as the star moves not but in his sphere, I could not but by her. The other motive, Why to a public count I might not go, Is the great love the general gender bear him, Who, dipping all his faults in their affection, Would like the spring that turneth wood to stone, Convert his gyves to graces; so that my arrows, Too slightly timber’d for so loud a wind, Would have reverted to my bow again, And not where I had aim’d them.
795	4	7	LAERTES	KING	And so have I a noble father lost, A sister driven into desperate terms, Whose worth, if praises may go back again, Stood challenger on mount of all the age For her perfections. But my revenge will come.
796	4	7	KING	LAERTES	Break not your sleeps for that. You must not think That we are made of stuff so flat and dull That we can let our beard be shook with danger, And think it pastime. You shortly shall hear more. I lov’d your father, and we love ourself, And that, I hope, will teach you to imagine— Enter a Messenger. How now? What news?
797	4	7	MESSENGER	KING	Letters, my lord, from Hamlet. This to your Majesty; this to the Queen.
798	4	7	KING	MESSENGER	From Hamlet! Who brought them?
799	4	7	MESSENGER	KING	Sailors, my lord, they say; I saw them not. They were given me by Claudio. He receiv’d them Of him that brought them.
800	4	7	KING	MESSENGER	Laertes, you shall hear them. Leave us. ‘High and mighty, you shall know I am set naked on your kingdom. Tomorrow shall I beg leave to see your kingly eyes. When I shall, first asking your pardon thereunto, recount the occasions of my sudden and more strange return.
801	4	7	HAMLET	KING	’ What should this mean? Are all the rest come back? Or is it some abuse, and no such thing?
802	4	7	LAERTES	HAMLET	Know you the hand?
803	4	7	KING	LAERTES	’Tis Hamlet’s character. ’Naked!’ And in a postscript here he says ‘alone.’ Can you advise me?
804	4	7	LAERTES	KING	I am lost in it, my lord. But let him come, It warms the very sickness in my heart That I shall live and tell him to his teeth, ‘Thus diest thou.’
805	4	7	KING	LAERTES	If it be so, Laertes,— As how should it be so? How otherwise?— Will you be rul’d by me?
806	4	7	LAERTES	KING	Ay, my lord; So you will not o’errule me to a peace.
807	4	7	KING	LAERTES	To thine own peace. If he be now return’d, As checking at his voyage, and that he means No more to undertake it, I will work him To exploit, now ripe in my device, Under the which he shall not choose but fall; And for his death no wind shall breathe, But even his mother shall uncharge the practice And call it accident.
808	4	7	LAERTES	KING	My lord, I will be rul’d; The rather if you could devise it so That I might be the organ.
809	4	7	KING	LAERTES	It falls right. You have been talk’d of since your travel much, And that in Hamlet’s hearing, for a quality Wherein they say you shine. Your sum of parts Did not together pluck such envy from him As did that one, and that, in my regard, Of the unworthiest siege.
810	4	7	LAERTES	KING	What part is that, my lord?
811	4	7	KING	LAERTES	A very riband in the cap of youth, Yet needful too, for youth no less becomes The light and careless livery that it wears Than settled age his sables and his weeds, Importing health and graveness. Two months since Here was a gentleman of Normandy,— I’ve seen myself, and serv’d against, the French, And they can well on horseback, but this gallant Had witchcraft in’t. He grew unto his seat, And to such wondrous doing brought his horse, As had he been incorps’d and demi-natur’d With the brave beast. So far he topp’d my thought That I in forgery of shapes and tricks, Come short of what he did.
812	4	7	LAERTES	KING	A Norman was’t?
813	4	7	KING	LAERTES	A Norman.
814	4	7	LAERTES	KING	Upon my life, Lamond.
815	4	7	KING	LAERTES	The very same.
816	4	7	LAERTES	KING	I know him well. He is the brooch indeed And gem of all the nation.
817	4	7	KING	LAERTES	He made confession of you, And gave you such a masterly report For art and exercise in your defence, And for your rapier most especially, That he cried out ’twould be a sight indeed If one could match you. The scrimers of their nation He swore had neither motion, guard, nor eye, If you oppos’d them. Sir, this report of his Did Hamlet so envenom with his envy That he could nothing do but wish and beg Your sudden coming o’er to play with him. Now, out of this,—
818	4	7	LAERTES	KING	What out of this, my lord?
819	4	7	KING	LAERTES	Laertes, was your father dear to you? Or are you like the painting of a sorrow, A face without a heart?
820	4	7	LAERTES	KING	Why ask you this?
821	4	7	KING	LAERTES	Not that I think you did not love your father, But that I know love is begun by time, And that I see, in passages of proof, Time qualifies the spark and fire of it. There lives within the very flame of love A kind of wick or snuff that will abate it; And nothing is at a like goodness still, For goodness, growing to a pleurisy, Dies in his own too much. That we would do, We should do when we would; for this ‘would’ changes, And hath abatements and delays as many As there are tongues, are hands, are accidents; And then this ‘should’ is like a spendthrift sigh That hurts by easing. But to the quick o’ th’ulcer: Hamlet comes back: what would you undertake To show yourself your father’s son in deed, More than in words?
822	4	7	LAERTES	KING	To cut his throat i’ th’ church.
823	4	7	KING	LAERTES	No place, indeed, should murder sanctuarize; Revenge should have no bounds. But good Laertes, Will you do this, keep close within your chamber. Hamlet return’d shall know you are come home: We’ll put on those shall praise your excellence, And set a double varnish on the fame The Frenchman gave you, bring you in fine together And wager on your heads. He, being remiss, Most generous, and free from all contriving, Will not peruse the foils; so that with ease, Or with a little shuffling, you may choose A sword unbated, and in a pass of practice, Requite him for your father.
824	4	7	LAERTES	KING	I will do’t. And for that purpose I’ll anoint my sword. I bought an unction of a mountebank So mortal that, but dip a knife in it, Where it draws blood no cataplasm so rare, Collected from all simples that have virtue Under the moon, can save the thing from death This is but scratch’d withal. I’ll touch my point With this contagion, that if I gall him slightly, It may be death.
825	4	7	KING	LAERTES	Let’s further think of this, Weigh what convenience both of time and means May fit us to our shape. If this should fail, And that our drift look through our bad performance. ’Twere better not assay’d. Therefore this project Should have a back or second, that might hold If this did blast in proof. Soft, let me see. We’ll make a solemn wager on your cunnings,— I ha’t! When in your motion you are hot and dry, As make your bouts more violent to that end, And that he calls for drink, I’ll have prepar’d him A chalice for the nonce; whereon but sipping, If he by chance escape your venom’d stuck, Our purpose may hold there. Enter Queen. How now, sweet Queen?
826	4	7	QUEEN	KING	One woe doth tread upon another’s heel, So fast they follow. Your sister’s drown’d, Laertes.
827	4	7	LAERTES	QUEEN	Drown’d! O, where?
828	4	7	QUEEN	LAERTES	There is a willow grows aslant a brook, That shows his hoary leaves in the glassy stream. There with fantastic garlands did she make Of crow-flowers, nettles, daisies, and long purples, That liberal shepherds give a grosser name, But our cold maids do dead men’s fingers call them. There on the pendant boughs her coronet weeds Clamb’ring to hang, an envious sliver broke, When down her weedy trophies and herself Fell in the weeping brook. Her clothes spread wide, And mermaid-like, awhile they bore her up, Which time she chaunted snatches of old tunes, As one incapable of her own distress, Or like a creature native and indued Unto that element. But long it could not be Till that her garments, heavy with their drink, Pull’d the poor wretch from her melodious lay To muddy death.
829	4	7	LAERTES	QUEEN	Alas, then she is drown’d?
830	4	7	QUEEN	LAERTES	Drown’d, drown’d.
831	4	7	LAERTES	QUEEN	Too much of water hast thou, poor Ophelia, And therefore I forbid my tears. But yet It is our trick; nature her custom holds, Let shame say what it will. When these are gone, The woman will be out. Adieu, my lord, I have a speech of fire, that fain would blaze, But that this folly douts it.
832	4	7	KING	LAERTES	Let’s follow, Gertrude; How much I had to do to calm his rage! Now fear I this will give it start again; Therefore let’s follow.
833	5	1	FIRST CLOWN	SECOND CLOWN	Is she to be buried in Christian burial, when she wilfully seeks her own salvation?
834	5	1	SECOND CLOWN	FIRST CLOWN	I tell thee she is, and therefore make her grave straight. The crowner hath sat on her, and finds it Christian burial.
835	5	1	FIRST CLOWN	SECOND CLOWN	How can that be, unless she drowned herself in her own defence?
836	5	1	SECOND CLOWN	FIRST CLOWN	Why, ’tis found so.
837	5	1	FIRST CLOWN	SECOND CLOWN	It must be _se offendendo_, it cannot be else. For here lies the point: if I drown myself wittingly, it argues an act: and an act hath three branches. It is to act, to do, and to perform: argal, she drowned herself wittingly.
838	5	1	SECOND CLOWN	FIRST CLOWN	Nay, but hear you, goodman delver,—
839	5	1	FIRST CLOWN	SECOND CLOWN	Give me leave. Here lies the water; good. Here stands the man; good. If the man go to this water and drown himself, it is, will he nill he, he goes,—mark you that. But if the water come to him and drown him, he drowns not himself. Argal, he that is not guilty of his own death shortens not his own life.
840	5	1	SECOND CLOWN	FIRST CLOWN	But is this law?
841	5	1	FIRST CLOWN	SECOND CLOWN	Ay, marry, is’t, crowner’s quest law.
842	5	1	SECOND CLOWN	FIRST CLOWN	Will you ha’ the truth on’t? If this had not been a gentlewoman, she should have been buried out o’ Christian burial.
843	5	1	FIRST CLOWN	SECOND CLOWN	Why, there thou say’st. And the more pity that great folk should have countenance in this world to drown or hang themselves more than their even Christian. Come, my spade. There is no ancient gentlemen but gardeners, ditchers, and grave-makers: they hold up Adam’s profession.
844	5	1	SECOND CLOWN	FIRST CLOWN	Was he a gentleman?
845	5	1	FIRST CLOWN	SECOND CLOWN	He was the first that ever bore arms.
846	5	1	SECOND CLOWN	FIRST CLOWN	Why, he had none.
847	5	1	FIRST CLOWN	SECOND CLOWN	What, art a heathen? How dost thou understand the Scripture? The Scripture says Adam digg’d. Could he dig without arms? I’ll put another question to thee. If thou answerest me not to the purpose, confess thyself—
848	5	1	SECOND CLOWN	FIRST CLOWN	Go to.
849	5	1	FIRST CLOWN	SECOND CLOWN	What is he that builds stronger than either the mason, the shipwright, or the carpenter?
850	5	1	SECOND CLOWN	FIRST CLOWN	The gallows-maker; for that frame outlives a thousand tenants.
851	5	1	FIRST CLOWN	SECOND CLOWN	I like thy wit well in good faith, the gallows does well. But how does it well? It does well to those that do ill. Now, thou dost ill to say the gallows is built stronger than the church; argal, the gallows may do well to thee. To’t again, come.
852	5	1	SECOND CLOWN	FIRST CLOWN	Who builds stronger than a mason, a shipwright, or a carpenter?
853	5	1	FIRST CLOWN	SECOND CLOWN	Ay, tell me that, and unyoke.
854	5	1	SECOND CLOWN	FIRST CLOWN	Marry, now I can tell.
855	5	1	FIRST CLOWN	SECOND CLOWN	To’t.
856	5	1	SECOND CLOWN	FIRST CLOWN	Mass, I cannot tell. Enter Hamlet and Horatio, at a distance.
857	5	1	FIRST CLOWN	SECOND CLOWN	Cudgel thy brains no more about it, for your dull ass will not mend his pace with beating; and when you are asked this question next, say ‘a grave-maker’. The houses he makes last till doomsday. Go, get thee to Yaughan; fetch me a stoup of liquor. In youth when I did love, did love, Methought it was very sweet; To contract, O, the time for, a, my behove, O methought there was nothing meet.
858	5	1	HAMLET	FIRST CLOWN	Has this fellow no feeling of his business, that he sings at grave-making?
859	5	1	HORATIO	HAMLET	Custom hath made it in him a property of easiness.
860	5	1	HAMLET	HORATIO	’Tis e’en so; the hand of little employment hath the daintier sense.
861	5	1	FIRST CLOWN	HAMLET	But age with his stealing steps Hath claw’d me in his clutch, And hath shipp’d me into the land, As if I had never been such.
862	5	1	HAMLET	FIRST CLOWN	That skull had a tongue in it, and could sing once. How the knave jowls it to th’ ground, as if ’twere Cain’s jawbone, that did the first murder! This might be the pate of a politician which this ass now o’er-offices, one that would circumvent God, might it not?
863	5	1	HORATIO	HAMLET	It might, my lord.
864	5	1	HAMLET	HORATIO	Or of a courtier, which could say ‘Good morrow, sweet lord! How dost thou, good lord?’ This might be my lord such-a-one, that praised my lord such-a-one’s horse when he meant to beg it, might it not?
865	5	1	HORATIO	HAMLET	Ay, my lord.
866	5	1	HAMLET	HORATIO	Why, e’en so: and now my Lady Worm’s; chapless, and knocked about the mazard with a sexton’s spade. Here’s fine revolution, an we had the trick to see’t. Did these bones cost no more the breeding but to play at loggets with ’em? Mine ache to think on’t.
867	5	1	FIRST CLOWN	HAMLET	A pickaxe and a spade, a spade, For and a shrouding-sheet; O, a pit of clay for to be made For such a guest is meet.
868	5	1	HAMLET	FIRST CLOWN	There’s another. Why may not that be the skull of a lawyer? Where be his quiddits now, his quillets, his cases, his tenures, and his tricks? Why does he suffer this rude knave now to knock him about the sconce with a dirty shovel, and will not tell him of his action of battery? Hum. This fellow might be in’s time a great buyer of land, with his statutes, his recognizances, his fines, his double vouchers, his recoveries. Is this the fine of his fines, and the recovery of his recoveries, to have his fine pate full of fine dirt? Will his vouchers vouch him no more of his purchases, and double ones too, than the length and breadth of a pair of indentures? The very conveyances of his lands will scarcely lie in this box; and must the inheritor himself have no more, ha?
869	5	1	HORATIO	HAMLET	Not a jot more, my lord.
870	5	1	HAMLET	HORATIO	Is not parchment made of sheep-skins?
871	5	1	HORATIO	HAMLET	Ay, my lord, and of calf-skins too.
872	5	1	HAMLET	HORATIO	They are sheep and calves which seek out assurance in that. I will speak to this fellow.—Whose grave’s this, sir?
873	5	1	FIRST CLOWN	HAMLET	Mine, sir. O, a pit of clay for to be made For such a guest is meet.
874	5	1	HAMLET	FIRST CLOWN	I think it be thine indeed, for thou liest in’t.
875	5	1	FIRST CLOWN	HAMLET	You lie out on’t, sir, and therefore ’tis not yours. For my part, I do not lie in’t, yet it is mine.
876	5	1	HAMLET	FIRST CLOWN	Thou dost lie in’t, to be in’t and say it is thine. ’Tis for the dead, not for the quick; therefore thou liest.
877	5	1	FIRST CLOWN	HAMLET	’Tis a quick lie, sir; ’t will away again from me to you.
878	5	1	HAMLET	FIRST CLOWN	What man dost thou dig it for?
879	5	1	FIRST CLOWN	HAMLET	For no man, sir.
880	5	1	HAMLET	FIRST CLOWN	What woman then?
881	5	1	FIRST CLOWN	HAMLET	For none neither.
882	5	1	HAMLET	FIRST CLOWN	Who is to be buried in’t?
883	5	1	FIRST CLOWN	HAMLET	One that was a woman, sir; but, rest her soul, she’s dead.
884	5	1	HAMLET	FIRST CLOWN	How absolute the knave is! We must speak by the card, or equivocation will undo us. By the Lord, Horatio, these three years I have taken note of it, the age is grown so picked that the toe of the peasant comes so near the heel of the courtier he galls his kibe.—How long hast thou been a grave-maker?
885	5	1	FIRST CLOWN	HAMLET	Of all the days i’ th’ year, I came to’t that day that our last King Hamlet o’ercame Fortinbras.
886	5	1	HAMLET	FIRST CLOWN	How long is that since?
887	5	1	FIRST CLOWN	HAMLET	Cannot you tell that? Every fool can tell that. It was the very day that young Hamlet was born,—he that is mad, and sent into England.
888	5	1	HAMLET	FIRST CLOWN	Ay, marry, why was he sent into England?
889	5	1	FIRST CLOWN	HAMLET	Why, because he was mad; he shall recover his wits there; or if he do not, it’s no great matter there.
890	5	1	HAMLET	FIRST CLOWN	Why?
891	5	1	FIRST CLOWN	HAMLET	’Twill not be seen in him there; there the men are as mad as he.
