	act	scene	char_from	char_to	sentence
596	3	3	HAMLET	KING	Now might I do it pat, now he is praying. And now I’ll do’t. And so he goes to heaven; And so am I reveng’d. That would be scann’d: A villain kills my father, and for that I, his sole son, do this same villain send To heaven. O, this is hire and salary, not revenge. He took my father grossly, full of bread, With all his crimes broad blown, as flush as May; And how his audit stands, who knows save heaven? But in our circumstance and course of thought, ’Tis heavy with him. And am I then reveng’d, To take him in the purging of his soul, When he is fit and season’d for his passage? No. Up, sword, and know thou a more horrid hent: When he is drunk asleep; or in his rage, Or in th’incestuous pleasure of his bed, At gaming, swearing; or about some act That has no relish of salvation in’t, Then trip him, that his heels may kick at heaven, And that his soul may be as damn’d and black As hell, whereto it goes. My mother stays. This physic but prolongs thy sickly days. The King rises and advances.
597	3	3	KING	HAMLET	My words fly up, my thoughts remain below. Words without thoughts never to heaven go.
598	3	4	POLONIUS	HAMLET	He will come straight. Look you lay home to him, Tell him his pranks have been too broad to bear with, And that your Grace hath screen’d and stood between Much heat and him. I’ll silence me e’en here. Pray you be round with him.
599	3	4	HAMLET	POLONIUS	Mother, mother, mother.
600	3	4	QUEEN	HAMLET	I’ll warrant you, Fear me not. Withdraw, I hear him coming. Enter Hamlet.
601	3	4	HAMLET	QUEEN	Now, mother, what’s the matter?
602	3	4	QUEEN	HAMLET	Hamlet, thou hast thy father much offended.
603	3	4	HAMLET	QUEEN	Mother, you have my father much offended.
604	3	4	QUEEN	HAMLET	Come, come, you answer with an idle tongue.
605	3	4	HAMLET	QUEEN	Go, go, you question with a wicked tongue.
606	3	4	QUEEN	HAMLET	Why, how now, Hamlet?
607	3	4	HAMLET	QUEEN	What’s the matter now?
608	3	4	QUEEN	HAMLET	Have you forgot me?
609	3	4	HAMLET	QUEEN	No, by the rood, not so. You are the Queen, your husband’s brother’s wife, And, would it were not so. You are my mother.
610	3	4	QUEEN	HAMLET	Nay, then I’ll set those to you that can speak.
611	3	4	HAMLET	QUEEN	Come, come, and sit you down, you shall not budge. You go not till I set you up a glass Where you may see the inmost part of you.
612	3	4	QUEEN	HAMLET	What wilt thou do? Thou wilt not murder me? Help, help, ho!
613	3	4	POLONIUS	QUEEN	What, ho! help, help, help!
614	3	4	HAMLET	POLONIUS	How now? A rat? Dead for a ducat, dead!
615	3	4	POLONIUS	HAMLET	O, I am slain!
616	3	4	QUEEN	POLONIUS	O me, what hast thou done?
617	3	4	HAMLET	QUEEN	Nay, I know not. is it the King?
618	3	4	QUEEN	HAMLET	O what a rash and bloody deed is this!
619	3	4	HAMLET	QUEEN	A bloody deed. Almost as bad, good mother, As kill a king and marry with his brother.
620	3	4	QUEEN	HAMLET	As kill a king?
621	3	4	HAMLET	QUEEN	Ay, lady, ’twas my word.— Thou wretched, rash, intruding fool, farewell! I took thee for thy better. Take thy fortune, Thou find’st to be too busy is some danger.— Leave wringing of your hands. Peace, sit you down, And let me wring your heart, for so I shall, If it be made of penetrable stuff; If damned custom have not braz’d it so, That it is proof and bulwark against sense.
622	3	4	QUEEN	HAMLET	What have I done, that thou dar’st wag thy tongue In noise so rude against me?
623	3	4	HAMLET	QUEEN	Such an act That blurs the grace and blush of modesty, Calls virtue hypocrite, takes off the rose From the fair forehead of an innocent love, And sets a blister there. Makes marriage vows As false as dicers’ oaths. O such a deed As from the body of contraction plucks The very soul, and sweet religion makes A rhapsody of words. Heaven’s face doth glow, Yea this solidity and compound mass, With tristful visage, as against the doom, Is thought-sick at the act.
624	3	4	QUEEN	HAMLET	Ay me, what act, That roars so loud, and thunders in the index?
625	3	4	HAMLET	QUEEN	Look here upon this picture, and on this, The counterfeit presentment of two brothers. See what a grace was seated on this brow, Hyperion’s curls, the front of Jove himself, An eye like Mars, to threaten and command, A station like the herald Mercury New lighted on a heaven-kissing hill: A combination and a form indeed, Where every god did seem to set his seal, To give the world assurance of a man. This was your husband. Look you now what follows. Here is your husband, like a mildew’d ear Blasting his wholesome brother. Have you eyes? Could you on this fair mountain leave to feed, And batten on this moor? Ha! have you eyes? You cannot call it love; for at your age The hey-day in the blood is tame, it’s humble, And waits upon the judgment: and what judgment Would step from this to this? Sense sure you have, Else could you not have motion; but sure that sense Is apoplex’d, for madness would not err Nor sense to ecstacy was ne’er so thrall’d But it reserv’d some quantity of choice To serve in such a difference. What devil was’t That thus hath cozen’d you at hoodman-blind? Eyes without feeling, feeling without sight, Ears without hands or eyes, smelling sans all, Or but a sickly part of one true sense Could not so mope. O shame! where is thy blush? Rebellious hell, If thou canst mutine in a matron’s bones, To flaming youth let virtue be as wax, And melt in her own fire. Proclaim no shame When the compulsive ardour gives the charge, Since frost itself as actively doth burn, And reason panders will.
626	3	4	QUEEN	HAMLET	O Hamlet, speak no more. Thou turn’st mine eyes into my very soul, And there I see such black and grained spots As will not leave their tinct.
627	3	4	HAMLET	QUEEN	Nay, but to live In the rank sweat of an enseamed bed, Stew’d in corruption, honeying and making love Over the nasty sty.
628	3	4	QUEEN	HAMLET	O speak to me no more; These words like daggers enter in mine ears; No more, sweet Hamlet.
629	3	4	HAMLET	QUEEN	A murderer and a villain; A slave that is not twentieth part the tithe Of your precedent lord. A vice of kings, A cutpurse of the empire and the rule, That from a shelf the precious diadem stole And put it in his pocket!
630	3	4	QUEEN	HAMLET	No more.
631	3	4	HAMLET	QUEEN	A king of shreds and patches!— Enter Ghost. Save me and hover o’er me with your wings, You heavenly guards! What would your gracious figure?
632	3	4	QUEEN	HAMLET	Alas, he’s mad.
633	3	4	HAMLET	QUEEN	Do you not come your tardy son to chide, That, laps’d in time and passion, lets go by The important acting of your dread command? O say!
634	3	4	GHOST	HAMLET	Do not forget. This visitation Is but to whet thy almost blunted purpose. But look, amazement on thy mother sits. O step between her and her fighting soul. Conceit in weakest bodies strongest works. Speak to her, Hamlet.
635	3	4	HAMLET	GHOST	How is it with you, lady?
636	3	4	QUEEN	HAMLET	Alas, how is’t with you, That you do bend your eye on vacancy, And with the incorporal air do hold discourse? Forth at your eyes your spirits wildly peep, And, as the sleeping soldiers in the alarm, Your bedded hairs, like life in excrements, Start up and stand an end. O gentle son, Upon the heat and flame of thy distemper Sprinkle cool patience. Whereon do you look?
637	3	4	HAMLET	QUEEN	On him, on him! Look you how pale he glares, His form and cause conjoin’d, preaching to stones, Would make them capable.—Do not look upon me, Lest with this piteous action you convert My stern effects. Then what I have to do Will want true colour; tears perchance for blood.
638	3	4	QUEEN	HAMLET	To whom do you speak this?
639	3	4	HAMLET	QUEEN	Do you see nothing there?
640	3	4	QUEEN	HAMLET	Nothing at all; yet all that is I see.
641	3	4	HAMLET	QUEEN	Nor did you nothing hear?
642	3	4	QUEEN	HAMLET	No, nothing but ourselves.
643	3	4	HAMLET	QUEEN	Why, look you there! look how it steals away! My father, in his habit as he liv’d! Look where he goes even now out at the portal.
644	3	4	QUEEN	HAMLET	This is the very coinage of your brain. This bodiless creation ecstasy Is very cunning in.
645	3	4	HAMLET	QUEEN	Ecstasy! My pulse as yours doth temperately keep time, And makes as healthful music. It is not madness That I have utter’d. Bring me to the test, And I the matter will re-word; which madness Would gambol from. Mother, for love of grace, Lay not that flattering unction to your soul That not your trespass, but my madness speaks. It will but skin and film the ulcerous place, Whilst rank corruption, mining all within, Infects unseen. Confess yourself to heaven, Repent what’s past, avoid what is to come; And do not spread the compost on the weeds, To make them ranker. Forgive me this my virtue; For in the fatness of these pursy times Virtue itself of vice must pardon beg, Yea, curb and woo for leave to do him good.
646	3	4	QUEEN	HAMLET	O Hamlet, thou hast cleft my heart in twain.
647	3	4	HAMLET	QUEEN	O throw away the worser part of it, And live the purer with the other half. Good night. But go not to mine uncle’s bed. Assume a virtue, if you have it not. That monster custom, who all sense doth eat, Of habits evil, is angel yet in this, That to the use of actions fair and good He likewise gives a frock or livery That aptly is put on. Refrain tonight, And that shall lend a kind of easiness To the next abstinence. The next more easy; For use almost can change the stamp of nature, And either curb the devil, or throw him out With wondrous potency. Once more, good night, And when you are desirous to be bles’d, I’ll blessing beg of you. For this same lord I do repent; but heaven hath pleas’d it so, To punish me with this, and this with me, That I must be their scourge and minister. I will bestow him, and will answer well The death I gave him. So again, good night. I must be cruel, only to be kind: Thus bad begins, and worse remains behind. One word more, good lady.
648	3	4	QUEEN	HAMLET	What shall I do?
649	3	4	HAMLET	QUEEN	Not this, by no means, that I bid you do: Let the bloat King tempt you again to bed, Pinch wanton on your cheek, call you his mouse, And let him, for a pair of reechy kisses, Or paddling in your neck with his damn’d fingers, Make you to ravel all this matter out, That I essentially am not in madness, But mad in craft. ’Twere good you let him know, For who that’s but a queen, fair, sober, wise, Would from a paddock, from a bat, a gib, Such dear concernings hide? Who would do so? No, in despite of sense and secrecy, Unpeg the basket on the house’s top, Let the birds fly, and like the famous ape, To try conclusions, in the basket creep And break your own neck down.
650	3	4	QUEEN	HAMLET	Be thou assur’d, if words be made of breath, And breath of life, I have no life to breathe What thou hast said to me.
651	3	4	HAMLET	QUEEN	I must to England, you know that?
652	3	4	QUEEN	HAMLET	Alack, I had forgot. ’Tis so concluded on.
653	3	4	HAMLET	QUEEN	There’s letters seal’d: and my two schoolfellows, Whom I will trust as I will adders fang’d,— They bear the mandate, they must sweep my way And marshal me to knavery. Let it work; For ’tis the sport to have the enginer Hoist with his own petard, and ’t shall go hard But I will delve one yard below their mines And blow them at the moon. O, ’tis most sweet, When in one line two crafts directly meet. This man shall set me packing. I’ll lug the guts into the neighbour room. Mother, good night. Indeed, this counsellor Is now most still, most secret, and most grave, Who was in life a foolish peating knave. Come, sir, to draw toward an end with you. Good night, mother.
654	4	1	KING	QUEEN	There’s matter in these sighs. These profound heaves You must translate. ’tis fit we understand them. Where is your son?
655	4	1	QUEEN	KING	Bestow this place on us a little while. Ah, my good lord, what have I seen tonight!
656	4	1	KING	QUEEN	What, Gertrude? How does Hamlet?
657	4	1	QUEEN	KING	Mad as the sea and wind, when both contend Which is the mightier. In his lawless fit Behind the arras hearing something stir, Whips out his rapier, cries ‘A rat, a rat!’ And in this brainish apprehension kills The unseen good old man.
658	4	1	KING	QUEEN	O heavy deed! It had been so with us, had we been there. His liberty is full of threats to all; To you yourself, to us, to everyone. Alas, how shall this bloody deed be answer’d? It will be laid to us, whose providence Should have kept short, restrain’d, and out of haunt This mad young man. But so much was our love We would not understand what was most fit, But like the owner of a foul disease, To keep it from divulging, let it feed Even on the pith of life. Where is he gone?
659	4	1	QUEEN	KING	To draw apart the body he hath kill’d, O’er whom his very madness, like some ore Among a mineral of metals base, Shows itself pure. He weeps for what is done.
660	4	1	KING	QUEEN	O Gertrude, come away! The sun no sooner shall the mountains touch But we will ship him hence, and this vile deed We must with all our majesty and skill Both countenance and excuse.—Ho, Guildenstern! Re-enter Rosencrantz and Guildenstern. Friends both, go join you with some further aid: Hamlet in madness hath Polonius slain, And from his mother’s closet hath he dragg’d him. Go seek him out, speak fair, and bring the body Into the chapel. I pray you haste in this. Come, Gertrude, we’ll call up our wisest friends, And let them know both what we mean to do And what’s untimely done, so haply slander, Whose whisper o’er the world’s diameter, As level as the cannon to his blank, Transports his poison’d shot, may miss our name, And hit the woundless air. O, come away! My soul is full of discord and dismay.
661	4	2	HAMLET	GUILDENSTERN	Safely stowed. ROSENCRANTZ and
662	4	2	GUILDENSTERN	HAMLET	Hamlet! Lord Hamlet!
663	4	2	HAMLET	GUILDENSTERN	What noise? Who calls on Hamlet? O, here they come. Enter Rosencrantz and Guildenstern.
664	4	2	ROSENCRANTZ	HAMLET	What have you done, my lord, with the dead body?
665	4	2	HAMLET	ROSENCRANTZ	Compounded it with dust, whereto ’tis kin.
666	4	2	ROSENCRANTZ	HAMLET	Tell us where ’tis, that we may take it thence, And bear it to the chapel.
667	4	2	HAMLET	ROSENCRANTZ	Do not believe it.
668	4	2	ROSENCRANTZ	HAMLET	Believe what?
669	4	2	HAMLET	ROSENCRANTZ	That I can keep your counsel, and not mine own. Besides, to be demanded of a sponge—what replication should be made by the son of a king?
670	4	2	ROSENCRANTZ	HAMLET	Take you me for a sponge, my lord?
671	4	2	HAMLET	ROSENCRANTZ	Ay, sir; that soaks up the King’s countenance, his rewards, his authorities. But such officers do the King best service in the end: he keeps them, like an ape, in the corner of his jaw; first mouthed, to be last swallowed: when he needs what you have gleaned, it is but squeezing you, and, sponge, you shall be dry again.
672	4	2	ROSENCRANTZ	HAMLET	I understand you not, my lord.
673	4	2	HAMLET	ROSENCRANTZ	I am glad of it. A knavish speech sleeps in a foolish ear.
674	4	2	ROSENCRANTZ	HAMLET	My lord, you must tell us where the body is and go with us to the King.
675	4	2	HAMLET	ROSENCRANTZ	The body is with the King, but the King is not with the body. The King is a thing—
676	4	2	GUILDENSTERN	HAMLET	A thing, my lord!
677	4	2	HAMLET	GUILDENSTERN	Of nothing. Bring me to him. Hide fox, and all after.
678	4	3	KING	ROSENCRANTZ	I have sent to seek him and to find the body. How dangerous is it that this man goes loose! Yet must not we put the strong law on him: He’s lov’d of the distracted multitude, Who like not in their judgment, but their eyes; And where ’tis so, th’offender’s scourge is weigh’d, But never the offence. To bear all smooth and even, This sudden sending him away must seem Deliberate pause. Diseases desperate grown By desperate appliance are reliev’d, Or not at all. Enter Rosencrantz. How now? What hath befall’n?
679	4	3	ROSENCRANTZ	KING	Where the dead body is bestow’d, my lord, We cannot get from him.
680	4	3	KING	ROSENCRANTZ	But where is he?
681	4	3	ROSENCRANTZ	KING	Without, my lord, guarded, to know your pleasure.
682	4	3	KING	ROSENCRANTZ	Bring him before us.
683	4	3	ROSENCRANTZ	KING	Ho, Guildenstern! Bring in my lord. Enter Hamlet and Guildenstern.
684	4	3	KING	ROSENCRANTZ	Now, Hamlet, where’s Polonius?
685	4	3	HAMLET	KING	At supper.
686	4	3	KING	HAMLET	At supper? Where?
687	4	3	HAMLET	KING	Not where he eats, but where he is eaten. A certain convocation of politic worms are e’en at him. Your worm is your only emperor for diet. We fat all creatures else to fat us, and we fat ourselves for maggots. Your fat king and your lean beggar is but variable service,—two dishes, but to one table. That’s the end.
688	4	3	KING	HAMLET	Alas, alas!
689	4	3	HAMLET	KING	A man may fish with the worm that hath eat of a king, and eat of the fish that hath fed of that worm.
690	4	3	KING	HAMLET	What dost thou mean by this?
691	4	3	HAMLET	KING	Nothing but to show you how a king may go a progress through the guts of a beggar.
692	4	3	KING	HAMLET	Where is Polonius?
693	4	3	HAMLET	KING	In heaven. Send thither to see. If your messenger find him not there, seek him i’ th’other place yourself. But indeed, if you find him not within this month, you shall nose him as you go up the stairs into the lobby.
694	4	3	KING	HAMLET	Go seek him there.
695	4	3	HAMLET	KING	He will stay till you come.
696	4	3	KING	HAMLET	Hamlet, this deed, for thine especial safety,— Which we do tender, as we dearly grieve For that which thou hast done,—must send thee hence With fiery quickness. Therefore prepare thyself; The bark is ready, and the wind at help, Th’associates tend, and everything is bent For England.
697	4	3	HAMLET	KING	For England?
698	4	3	KING	HAMLET	Ay, Hamlet.
699	4	3	HAMLET	KING	Good.
700	4	3	KING	HAMLET	So is it, if thou knew’st our purposes.
701	4	3	HAMLET	KING	I see a cherub that sees them. But, come; for England! Farewell, dear mother.
702	4	3	KING	HAMLET	Thy loving father, Hamlet.
703	4	3	HAMLET	KING	My mother. Father and mother is man and wife; man and wife is one flesh; and so, my mother. Come, for England.
704	4	3	KING	HAMLET	Follow him at foot. Tempt him with speed aboard; Delay it not; I’ll have him hence tonight. Away, for everything is seal’d and done That else leans on th’affair. Pray you make haste. And England, if my love thou hold’st at aught,— As my great power thereof may give thee sense, Since yet thy cicatrice looks raw and red After the Danish sword, and thy free awe Pays homage to us,—thou mayst not coldly set Our sovereign process, which imports at full, By letters conjuring to that effect, The present death of Hamlet. Do it, England; For like the hectic in my blood he rages, And thou must cure me. Till I know ’tis done, Howe’er my haps, my joys were ne’er begun.
705	4	4	FORTINBRAS	CAPTAIN	Go, Captain, from me greet the Danish king. Tell him that by his license, Fortinbras Craves the conveyance of a promis’d march Over his kingdom. You know the rendezvous. If that his Majesty would aught with us, We shall express our duty in his eye; And let him know so.
706	4	4	CAPTAIN	FORTINBRAS	I will do’t, my lord.
707	4	4	FORTINBRAS	CAPTAIN	Go softly on. Enter Hamlet, Rosencrantz, Guildenstern &c.
708	4	4	HAMLET	FORTINBRAS	Good sir, whose powers are these?
709	4	4	CAPTAIN	HAMLET	They are of Norway, sir.
710	4	4	HAMLET	CAPTAIN	How purpos’d, sir, I pray you?
711	4	4	CAPTAIN	HAMLET	Against some part of Poland.
712	4	4	HAMLET	CAPTAIN	Who commands them, sir?
713	4	4	CAPTAIN	HAMLET	The nephew to old Norway, Fortinbras.
714	4	4	HAMLET	CAPTAIN	Goes it against the main of Poland, sir, Or for some frontier?
715	4	4	CAPTAIN	HAMLET	Truly to speak, and with no addition, We go to gain a little patch of ground That hath in it no profit but the name. To pay five ducats, five, I would not farm it; Nor will it yield to Norway or the Pole A ranker rate, should it be sold in fee.
716	4	4	HAMLET	CAPTAIN	Why, then the Polack never will defend it.
717	4	4	CAPTAIN	HAMLET	Yes, it is already garrison’d.
718	4	4	HAMLET	CAPTAIN	Two thousand souls and twenty thousand ducats Will not debate the question of this straw! This is th’imposthume of much wealth and peace, That inward breaks, and shows no cause without Why the man dies. I humbly thank you, sir.
719	4	4	CAPTAIN	HAMLET	God b’ wi’ you, sir.
720	4	4	ROSENCRANTZ	CAPTAIN	Will’t please you go, my lord?
721	4	4	HAMLET	ROSENCRANTZ	I’ll be with you straight. Go a little before. How all occasions do inform against me, And spur my dull revenge. What is a man If his chief good and market of his time Be but to sleep and feed? A beast, no more. Sure he that made us with such large discourse, Looking before and after, gave us not That capability and godlike reason To fust in us unus’d. Now whether it be Bestial oblivion, or some craven scruple Of thinking too precisely on th’event,— A thought which, quarter’d, hath but one part wisdom And ever three parts coward,—I do not know Why yet I live to say this thing’s to do, Sith I have cause, and will, and strength, and means To do’t. Examples gross as earth exhort me, Witness this army of such mass and charge, Led by a delicate and tender prince, Whose spirit, with divine ambition puff’d, Makes mouths at the invisible event, Exposing what is mortal and unsure To all that fortune, death, and danger dare, Even for an eggshell. Rightly to be great Is not to stir without great argument, But greatly to find quarrel in a straw When honour’s at the stake. How stand I then, That have a father kill’d, a mother stain’d, Excitements of my reason and my blood, And let all sleep, while to my shame I see The imminent death of twenty thousand men That, for a fantasy and trick of fame, Go to their graves like beds, fight for a plot Whereon the numbers cannot try the cause, Which is not tomb enough and continent To hide the slain? O, from this time forth, My thoughts be bloody or be nothing worth.
722	4	5	QUEEN	GENTLEMAN	I will not speak with her.
723	4	5	GENTLEMAN	QUEEN	She is importunate, indeed distract. Her mood will needs be pitied.
724	4	5	QUEEN	GENTLEMAN	What would she have?
725	4	5	GENTLEMAN	QUEEN	She speaks much of her father; says she hears There’s tricks i’ th’ world, and hems, and beats her heart, Spurns enviously at straws, speaks things in doubt, That carry but half sense. Her speech is nothing, Yet the unshaped use of it doth move The hearers to collection; they aim at it, And botch the words up fit to their own thoughts, Which, as her winks, and nods, and gestures yield them, Indeed would make one think there might be thought, Though nothing sure, yet much unhappily. ’Twere good she were spoken with, for she may strew Dangerous conjectures in ill-breeding minds.
726	4	5	QUEEN	GENTLEMAN	Let her come in. To my sick soul, as sin’s true nature is, Each toy seems prologue to some great amiss. So full of artless jealousy is guilt, It spills itself in fearing to be spilt. Enter Ophelia.
727	4	5	OPHELIA	QUEEN	Where is the beauteous Majesty of Denmark?
728	4	5	QUEEN	OPHELIA	How now, Ophelia?
729	4	5	OPHELIA	QUEEN	How should I your true love know From another one? By his cockle bat and staff And his sandal shoon.
730	4	5	QUEEN	OPHELIA	Alas, sweet lady, what imports this song?
731	4	5	OPHELIA	QUEEN	Say you? Nay, pray you mark. He is dead and gone, lady, He is dead and gone, At his head a grass green turf, At his heels a stone.
732	4	5	QUEEN	OPHELIA	Nay, but Ophelia—
733	4	5	OPHELIA	QUEEN	Pray you mark. White his shroud as the mountain snow. Enter King.
734	4	5	QUEEN	OPHELIA	Alas, look here, my lord!
735	4	5	OPHELIA	QUEEN	Larded all with sweet flowers; Which bewept to the grave did go With true-love showers.
736	4	5	KING	OPHELIA	How do you, pretty lady?
737	4	5	OPHELIA	KING	Well, God dild you! They say the owl was a baker’s daughter. Lord, we know what we are, but know not what we may be. God be at your table!
738	4	5	KING	OPHELIA	Conceit upon her father.
739	4	5	OPHELIA	KING	Pray you, let’s have no words of this; but when they ask you what it means, say you this: Tomorrow is Saint Valentine’s day, All in the morning betime, And I a maid at your window, To be your Valentine. Then up he rose and donn’d his clothes, And dupp’d the chamber door, Let in the maid, that out a maid Never departed more.
740	4	5	KING	OPHELIA	Pretty Ophelia!
741	4	5	OPHELIA	KING	Indeed la, without an oath, I’ll make an end on’t. By Gis and by Saint Charity, Alack, and fie for shame! Young men will do’t if they come to’t; By Cock, they are to blame. Quoth she, before you tumbled me, You promis’d me to wed. So would I ha’ done, by yonder sun, An thou hadst not come to my bed.
742	4	5	KING	OPHELIA	How long hath she been thus?
743	4	5	OPHELIA	KING	I hope all will be well. We must be patient. But I cannot choose but weep, to think they would lay him i’ th’ cold ground. My brother shall know of it. And so I thank you for your good counsel. Come, my coach! Good night, ladies; good night, sweet ladies; good night, good night.
